"","ID","Description","GeneRatio","BgRatio","pvalue","p.adjust","qvalue","geneID","Count"
"GO:0048525","GO:0048525","negative regulation of viral process","15/43","90/18614",7.35537192100285e-25,5.87694216488128e-22,4.10352328224369e-22,"4938/9636/6772/4940/5610/3669/5359/4599/684/10410/64135/6737/3434/24138/4939",15
"GO:0045071","GO:0045071","negative regulation of viral genome replication","13/43","56/18614",1.2584007554974e-23,5.02731101821211e-21,3.51027579165064e-21,"4938/9636/4940/5610/3669/5359/4599/684/10410/64135/3434/24138/4939",13
"GO:0051607","GO:0051607","defense response to virus","19/43","303/18614",3.35109114639647e-23,7.13118240061606e-21,4.97928551785325e-21,"4938/9636/6772/151636/4940/5610/3669/3437/5359/4599/684/10410/10379/64135/6737/3429/3434/24138/4939",19
"GO:0140546","GO:0140546","defense response to symbiont","19/43","304/18614",3.57005376751742e-23,7.13118240061606e-21,4.97928551785325e-21,"4938/9636/6772/151636/4940/5610/3669/3437/5359/4599/684/10410/10379/64135/6737/3429/3434/24138/4939",19
"GO:0045069","GO:0045069","regulation of viral genome replication","14/43","86/18614",4.68021318912041e-23,7.47898067621442e-21,5.22213261101857e-21,"4938/9636/4940/5610/3669/5359/4599/684/10410/7153/64135/3434/24138/4939",14
"GO:0050792","GO:0050792","regulation of viral process","16/43","165/18614",1.49155452824289e-22,1.98625344677678e-20,1.38688403503286e-20,"4938/9636/6772/4940/5610/3669/5359/4599/684/10410/7153/64135/6737/3434/24138/4939",16
"GO:0019079","GO:0019079","viral genome replication","15/43","129/18614",2.27281910822783e-22,2.59426066782005e-20,1.81141974039211e-20,"4938/9636/4940/5610/3669/5359/4599/684/10410/7153/64135/3429/3434/24138/4939",15
"GO:1903900","GO:1903900","regulation of viral life cycle","15/43","143/18614",1.13871811631014e-21,1.13729471866475e-19,7.94106054795229e-20,"4938/9636/4940/5610/3669/5359/4599/684/10410/7153/64135/6737/3434/24138/4939",15
"GO:0009615","GO:0009615","response to virus","19/43","408/18614",9.74677944968964e-21,8.65297420033558e-19,6.04186328460294e-19,"4938/9636/6772/151636/4940/5610/3669/3437/5359/4599/684/10410/10379/64135/6737/3429/3434/24138/4939",19
"GO:0016032","GO:0016032","viral process","18/43","426/18614",7.47825123644862e-19,5.97512273792244e-17,4.17207700559765e-17,"4938/9636/6772/4940/5610/3669/5359/4599/684/10410/7153/84875/64135/6737/3429/3434/24138/4939",18
"GO:0019058","GO:0019058","viral life cycle","16/43","320/18614",6.98177906435947e-18,5.07131042947565e-16,3.54099799436413e-16,"4938/9636/4940/5610/3669/5359/4599/684/10410/7153/64135/6737/3429/3434/24138/4939",16
"GO:0034340","GO:0034340","response to type I interferon","11/43","83/18614",3.56913259857656e-17,2.37644745521889e-15,1.65933357653121e-15,"4938/9636/6772/4940/6672/4599/10410/3429/3434/4939/11274",11
"GO:0071357","GO:0071357","cellular response to type I interferon","10/43","77/18614",1.3750007261928e-15,8.45096600175423e-14,5.90081283305414e-14,"4938/9636/6772/4940/6672/10410/3429/3434/4939/11274",10
"GO:0140888","GO:0140888","interferon-mediated signaling pathway","10/43","100/18614",2.09044291180674e-14,1.19304563323827e-12,8.33033641547047e-13,"4938/9636/6772/4940/6672/54625/10410/3429/4939/11274",10
"GO:0060337","GO:0060337","type I interferon-mediated signaling pathway","9/43","76/18614",9.75057463982164e-14,5.19380609147833e-12,3.62652951516173e-12,"4938/9636/6772/4940/6672/10410/3429/4939/11274",9
"GO:0045824","GO:0045824","negative regulation of innate immune response","7/43","78/18614",4.91878208083604e-10,2.4563168016175e-08,1.7151016466073e-08,"4938/9636/4940/54625/6737/11274/3106",7
"GO:0032479","GO:0032479","regulation of type I interferon production","7/43","104/18614",3.7844179158295e-09,1.67986106374876e-07,1.17294824291792e-07,"4938/9636/6772/4940/64135/6737/4939",7
"GO:0032606","GO:0032606","type I interferon production","7/43","104/18614",3.7844179158295e-09,1.67986106374876e-07,1.17294824291792e-07,"4938/9636/6772/4940/64135/6737/4939",7
"GO:0002831","GO:0002831","regulation of response to biotic stimulus","11/43","463/18614",5.62093749338457e-09,2.3574097551272e-07,1.64604066954405e-07,"4938/9636/6772/151636/4940/5359/54625/64135/6737/11274/3106",11
"GO:0032481","GO:0032481","positive regulation of type I interferon production","6/43","62/18614",5.90090051345982e-09,2.3574097551272e-07,1.64604066954405e-07,"4938/9636/6772/4940/64135/4939",6
"GO:0035456","GO:0035456","response to interferon-beta","5/43","32/18614",9.94714758958016e-09,3.78465282098788e-07,2.64260061277067e-07,"4938/6772/5359/684/10410",5
"GO:0019221","GO:0019221","cytokine-mediated signaling pathway","11/43","492/18614",1.05411826987523e-08,3.82836589831957e-07,2.67312288532952e-07,"4938/9636/6772/4940/6672/4599/54625/10410/3429/4939/11274",11
"GO:0050777","GO:0050777","negative regulation of immune response","8/43","191/18614",1.13174756473614e-08,3.93159262706162e-07,2.74520004260939e-07,"4938/9636/4940/54625/6737/11274/3106/114770",8
"GO:0002832","GO:0002832","negative regulation of response to biotic stimulus","7/43","125/18614",1.37078581497637e-08,4.56357444235884e-07,3.18647579797139e-07,"4938/9636/4940/54625/6737/11274/3106",7
"GO:0032728","GO:0032728","positive regulation of interferon-beta production","5/43","38/18614",2.45418223871102e-08,7.84356643492043e-07,5.47670141691302e-07,"4938/9636/4940/64135/4939",5
"GO:0060339","GO:0060339","negative regulation of type I interferon-mediated signaling pathway","4/43","20/18614",1.16407065279293e-07,3.57727865992903e-06,2.49780342502126e-06,"4938/9636/4940/11274",4
"GO:0045088","GO:0045088","regulation of innate immune response","9/43","373/18614",1.46193221213989e-07,4.32623643518435e-06,3.02075661767697e-06,"4938/9636/4940/5359/54625/64135/6737/11274/3106",9
"GO:0032608","GO:0032608","interferon-beta production","5/43","56/18614",1.81127144556063e-07,4.99036512069982e-06,3.48447864300231e-06,"4938/9636/4940/64135/4939",5
"GO:0032648","GO:0032648","regulation of interferon-beta production","5/43","56/18614",1.81127144556063e-07,4.99036512069982e-06,3.48447864300231e-06,"4938/9636/4940/64135/4939",5
"GO:0019885","GO:0019885","antigen processing and presentation of endogenous peptide antigen via MHC class I","4/43","23/18614",2.11684438379692e-07,5.6378622088458e-06,3.93658780144691e-06,"6891/6892/6890/3106",4
"GO:0002483","GO:0002483","antigen processing and presentation of endogenous peptide antigen","4/43","25/18614",3.01393715612774e-07,7.76817996047117e-06,5.42406347282751e-06,"6891/6892/6890/3106",4
"GO:0140374","GO:0140374","antiviral innate immune response","4/43","26/18614",3.55595730554826e-07,8.87878089729081e-06,6.1995308287519e-06,"4938/4599/64135/3434",4
"GO:0034341","GO:0034341","response to type II interferon","6/43","139/18614",7.5575777161679e-07,1.82984987733883e-05,1.2776766154925e-05,"6772/6672/54625/684/10410/6737",6
"GO:0019883","GO:0019883","antigen processing and presentation of endogenous antigen","4/43","32/18614",8.46770066407616e-07,1.9899096560579e-05,1.38943695107132e-05,"6891/6892/6890/3106",4
"GO:0002683","GO:0002683","negative regulation of immune system process","9/43","487/18614",1.36358933903059e-06,3.05794460784202e-05,2.13518298156415e-05,"4938/9636/4940/54625/684/6737/11274/3106/114770",9
"GO:0002474","GO:0002474","antigen processing and presentation of peptide antigen via MHC class I","4/43","36/18614",1.37779732017913e-06,3.05794460784202e-05,2.13518298156415e-05,"6891/6892/6890/3106",4
"GO:0001960","GO:0001960","negative regulation of cytokine-mediated signaling pathway","5/43","87/18614",1.66199447336764e-06,3.5890096870831e-05,2.50599451176344e-05,"4938/9636/4940/54625/11274",5
"GO:0060761","GO:0060761","negative regulation of response to cytokine stimulus","5/43","92/18614",2.19322306936497e-06,4.61154008532266e-05,3.21996738715633e-05,"4938/9636/4940/54625/11274",5
"GO:0060338","GO:0060338","regulation of type I interferon-mediated signaling pathway","4/43","42/18614",2.59185856350608e-06,5.30998715959322e-05,3.70765192620303e-05,"4938/9636/4940/11274",4
"GO:0060759","GO:0060759","regulation of response to cytokine stimulus","6/43","177/18614",3.09203125482379e-06,6.17633243151053e-05,4.31256990804371e-05,"4938/9636/4940/54625/64135/11274",6
"GO:0031348","GO:0031348","negative regulation of defense response","7/43","284/18614",3.59974597397313e-06,7.01511471513301e-05,4.89824227523944e-05,"4938/9636/4940/54625/6737/11274/3106",7
"GO:0019882","GO:0019882","antigen processing and presentation","5/43","114/18614",6.30650745238432e-06,0.000119973796534645,8.37706503700173e-05,"6891/6892/6890/5696/3106",5
"GO:0044403","GO:0044403","biological process involved in symbiotic interaction","7/43","313/18614",6.81418549134403e-06,0.000126345319833145,8.82195105876648e-05,"5359/10410/6737/3429/3434/114770/117159",7
"GO:0042742","GO:0042742","defense response to bacterium","7/43","314/18614",6.95768970295167e-06,0.000126345319833145,8.82195105876648e-05,"4938/9636/4940/57674/4939/114770/117159",7
"GO:0035455","GO:0035455","response to interferon-alpha","3/43","18/18614",9.1461437674027e-06,0.000162394863781217,0.000113390788227449,"5610/684/10410",3
"GO:0032069","GO:0032069","regulation of nuclease activity","3/43","22/18614",1.71501963460302e-05,0.000297891453923437,0.00020800009298389,"4938/4940/4939",3
"GO:0000209","GO:0000209","protein polyubiquitination","6/43","244/18614",1.93776075963922e-05,0.000329419329138667,0.000230014155119549,"151636/9246/57674/84875/6737/3429",6
"GO:0048002","GO:0048002","antigen processing and presentation of peptide antigen","4/43","71/18614",2.14320670073256e-05,0.000356754615392774,0.000249100778813214,"6891/6892/6890/3106",4
"GO:0060333","GO:0060333","type II interferon-mediated signaling pathway","3/43","25/18614",2.54904251095578e-05,0.000415649993112993,0.000290223959356941,"6772/6672/54625",3
"GO:0001959","GO:0001959","regulation of cytokine-mediated signaling pathway","5/43","165/18614",3.77595918031858e-05,0.000603398277014909,0.000421317550646073,"4938/9636/4940/54625/11274",5
"GO:0032102","GO:0032102","negative regulation of response to external stimulus","7/43","446/18614",6.60981624152352e-05,0.00103553787783868,0.00072305523385087,"4938/9636/4940/54625/6737/11274/3106",7
"GO:1903321","GO:1903321","negative regulation of protein modification by small protein conjugation or removal","4/43","97/18614",7.31707982709017e-05,0.00112429745804712,0.000785030831651374,"9636/151636/84875/6737",4
"GO:0032760","GO:0032760","positive regulation of tumor necrosis factor production","4/43","105/18614",9.96067805467252e-05,0.00150161920107233,0.00104849242680763,"4938/4940/64135/4939",4
"GO:0051701","GO:0051701","biological process involved in interaction with host","5/43","206/18614",0.000108135987207265,0.0016000121070112,0.00111719440974368,"5359/10410/6737/3434/114770",5
"GO:1903557","GO:1903557","positive regulation of tumor necrosis factor superfamily cytokine production","4/43","109/18614",0.000115149490992252,0.00167280806005108,0.00116802354499318,"4938/4940/64135/4939",4
"GO:0001819","GO:0001819","positive regulation of cytokine production","7/43","489/18614",0.000117466845115997,0.00167600016513717,0.00117025240435109,"4938/9636/6772/4940/5610/64135/4939",7
"GO:0039530","GO:0039530","MDA-5 signaling pathway","2/43","11/18614",0.000282932765171775,0.00389764274779738,0.00272149483740546,"4940/64135",2
"GO:0070213","GO:0070213","protein auto-ADP-ribosylation","2/43","11/18614",0.000282932765171775,0.00389764274779738,0.00272149483740546,"84875/64761",2
"GO:0070534","GO:0070534","protein K63-linked ubiquitination","3/43","59/18614",0.000341108077177193,0.00461941277397589,0.00322546442290655,"57674/84875/6737",3
"GO:0048524","GO:0048524","positive regulation of viral process","3/43","64/18614",0.000433670334441697,0.00577504328698193,0.00403237328515964,"7153/6737/3434",3
"GO:0032897","GO:0032897","negative regulation of viral transcription","2/43","15/18614",0.000536983133764665,0.00692015361093495,0.00483193651774656,"10410/6737",2
"GO:0071639","GO:0071639","positive regulation of monocyte chemotactic protein-1 production","2/43","15/18614",0.000536983133764665,0.00692015361093495,0.00483193651774656,"4938/4940",2
"GO:0032722","GO:0032722","positive regulation of chemokine production","3/43","70/18614",0.00056430975131396,0.0071568808142834,0.00499722920963072,"4938/4940/5610",3
"GO:0016045","GO:0016045","detection of bacterium","2/43","16/18614",0.000612795433991833,0.00765036799624179,0.00534180230288934,"3106/114770",2
"GO:0002476","GO:0002476","antigen processing and presentation of endogenous peptide antigen via MHC class Ib","2/43","17/18614",0.000693483614387752,0.00827005086411663,0.00577449042616667,"6891/3106",2
"GO:0002484","GO:0002484","antigen processing and presentation of endogenous peptide antigen via MHC class I via ER pathway","2/43","17/18614",0.000693483614387752,0.00827005086411663,0.00577449042616667,"6891/3106",2
"GO:0071360","GO:0071360","cellular response to exogenous dsRNA","2/43","17/18614",0.000693483614387752,0.00827005086411663,0.00577449042616667,"64135/3434",2
"GO:0002428","GO:0002428","antigen processing and presentation of peptide antigen via MHC class Ib","2/43","18/18614",0.000779025798215296,0.00889202303962888,0.00620877703840762,"6891/3106",2
"GO:0072567","GO:0072567","chemokine (C-X-C motif) ligand 2 production","2/43","18/18614",0.000779025798215296,0.00889202303962888,0.00620877703840762,"4938/4940",2
"GO:2000341","GO:2000341","regulation of chemokine (C-X-C motif) ligand 2 production","2/43","18/18614",0.000779025798215296,0.00889202303962888,0.00620877703840762,"4938/4940",2
"GO:0051865","GO:0051865","protein autoubiquitination","3/43","80/18614",0.000833489994038966,0.0092620099147086,0.00646711712640216,"151636/57674/6737",3
"GO:0032640","GO:0032640","tumor necrosis factor production","4/43","185/18614",0.000861138166416616,0.0092620099147086,0.00646711712640216,"4938/4940/64135/4939",4
"GO:0032680","GO:0032680","regulation of tumor necrosis factor production","4/43","185/18614",0.000861138166416616,0.0092620099147086,0.00646711712640216,"4938/4940/64135/4939",4
"GO:0046782","GO:0046782","regulation of viral transcription","2/43","19/18614",0.000869400179728592,0.0092620099147086,0.00646711712640216,"10410/6737",2
"GO:0098543","GO:0098543","detection of other organism","2/43","19/18614",0.000869400179728592,0.0092620099147086,0.00646711712640216,"3106/114770",2
"GO:0071706","GO:0071706","tumor necrosis factor superfamily cytokine production","4/43","190/18614",0.000950935916744335,0.00986750386336004,0.00688989796137385,"4938/4940/64135/4939",4
"GO:1903555","GO:1903555","regulation of tumor necrosis factor superfamily cytokine production","4/43","190/18614",0.000950935916744335,0.00986750386336004,0.00688989796137385,"4938/4940/64135/4939",4
"GO:0031397","GO:0031397","negative regulation of protein ubiquitination","3/43","85/18614",0.000993986366721835,0.0101819885514198,0.00710948413444767,"9636/151636/84875",3
"GO:0071605","GO:0071605","monocyte chemotactic protein-1 production","2/43","21/18614",0.00106455866659117,0.0106322796825793,0.00742389596438578,"4938/4940",2
"GO:0071637","GO:0071637","regulation of monocyte chemotactic protein-1 production","2/43","21/18614",0.00106455866659117,0.0106322796825793,0.00742389596438578,"4938/4940",2
"GO:0071359","GO:0071359","cellular response to dsRNA","2/43","22/18614",0.00116929951361568,0.0115342013750485,0.00805365486960769,"64135/3434",2
"GO:0032727","GO:0032727","positive regulation of interferon-alpha production","2/43","23/18614",0.00127878604128078,0.0124603664266261,0.00870034148753288,"6772/64135",2
"GO:0002753","GO:0002753","cytosolic pattern recognition receptor signaling pathway","3/43","95/18614",0.00137079658929824,0.013094169880714,0.0091428891861912,"4938/4940/64135",3
"GO:0035458","GO:0035458","cellular response to interferon-beta","2/43","24/18614",0.00139299679582064,0.013094169880714,0.0091428891861912,"4938/6772",2
"GO:0098581","GO:0098581","detection of external biotic stimulus","2/43","24/18614",0.00139299679582064,0.013094169880714,0.0091428891861912,"3106/114770",2
"GO:0032642","GO:0032642","regulation of chemokine production","3/43","98/18614",0.00149905977757157,0.0138852460255833,0.00969525116073928,"4938/4940/5610",3
"GO:0002475","GO:0002475","antigen processing and presentation via MHC class Ib","2/43","25/18614",0.00151191039327378,0.0138852460255833,0.00969525116073928,"6891/3106",2
"GO:0032602","GO:0032602","chemokine production","3/43","99/18614",0.00154342943418901,0.0140136377036025,0.00978489952296863,"4938/4940/5610",3
"GO:0019080","GO:0019080","viral gene expression","3/43","100/18614",0.00158861609598997,0.0142618456257976,0.00995820852601634,"10410/84875/6737",3
"GO:1903901","GO:1903901","negative regulation of viral life cycle","2/43","26/18614",0.00163550551928696,0.0145196545545587,0.0101382213476268,"684/10410",2
"GO:0032682","GO:0032682","negative regulation of chemokine production","2/43","27/18614",0.0017637609289197,0.0154862085956796,0.0108131092229895,"4938/4940",2
"GO:0042398","GO:0042398","cellular modified amino acid biosynthetic process","2/43","28/18614",0.00189665544644915,0.0164720402360094,0.0115014575127923,"5359/2356",2
"GO:0032607","GO:0032607","interferon-alpha production","2/43","29/18614",0.00203416796517559,0.0172904277039925,0.0120728893789816,"6772/64135",2
"GO:0032647","GO:0032647","regulation of interferon-alpha production","2/43","29/18614",0.00203416796517559,0.0172904277039925,0.0120728893789816,"6772/64135",2
"GO:0002230","GO:0002230","positive regulation of defense response to virus by host","2/43","31/18614",0.00232296292337238,0.0195373407976267,0.0136417767245137,"6772/151636",2
"GO:0071346","GO:0071346","cellular response to type II interferon","3/43","116/18614",0.00242710036522096,0.0201723325587666,0.0140851541481408,"6772/6672/54625",3
"GO:0045070","GO:0045070","positive regulation of viral genome replication","2/43","32/18614",0.00247420349281493,0.0201723325587666,0.0140851541481408,"7153/3434",2
"GO:0046825","GO:0046825","regulation of protein export from nucleus","2/43","32/18614",0.00247420349281493,0.0201723325587666,0.0140851541481408,"6672/3429",2
"GO:0045648","GO:0045648","positive regulation of erythrocyte differentiation","2/43","34/18614",0.00279026664948237,0.0221517585349645,0.0154672709617695,"9636/6772",2
"GO:1903320","GO:1903320","regulation of protein modification by small protein conjugation or removal","4/43","255/18614",0.00279105904793987,0.0221517585349645,0.0154672709617695,"9636/151636/84875/6737",4
"GO:0002698","GO:0002698","negative regulation of immune effector process","3/43","122/18614",0.00280015971468262,0.0221517585349645,0.0154672709617695,"684/3106/114770",3
"GO:0043122","GO:0043122","regulation of I-kappaB kinase/NF-kappaB signaling","4/43","258/18614",0.00291096832088831,0.0228025851802918,0.0159217049542911,"6772/684/6737/24138",4
"GO:0009595","GO:0009595","detection of biotic stimulus","2/43","38/18614",0.0034761419996775,0.0269654122110905,0.0188283623896686,"3106/114770",2
"GO:0001916","GO:0001916","positive regulation of T cell mediated cytotoxicity","2/43","40/18614",0.00384562574593925,0.029544759336591,0.0206293688800385,"6891/3106",2
"GO:0050691","GO:0050691","regulation of defense response to virus by host","2/43","42/18614",0.00423258969659885,0.0322079920722141,0.0224889477613773,"6772/151636",2
"GO:0007249","GO:0007249","I-kappaB kinase/NF-kappaB signaling","4/43","293/18614",0.0045809094271997,0.0345296852106845,0.0241100496168405,"6772/684/6737/24138",4
"GO:0045089","GO:0045089","positive regulation of innate immune response","4/43","300/18614",0.00497875140040335,0.0371777791488063,0.0259590579657036,"4938/4940/5359/64135",4
"GO:0045646","GO:0045646","regulation of erythrocyte differentiation","2/43","47/18614",0.005275417899407,0.038723000426159,0.0270379951595604,"9636/6772",2
"GO:0046718","GO:0046718","viral entry into host cell","3/43","153/18614",0.00528261207315561,0.038723000426159,0.0270379951595604,"5359/10410/6737",3
"GO:0046596","GO:0046596","regulation of viral entry into host cell","2/43","48/18614",0.00549675256220736,0.0399264117927607,0.027878266583444,"10410/6737",2
"GO:0043330","GO:0043330","response to exogenous dsRNA","2/43","49/18614",0.00572229729183446,0.0411902300556372,0.0287607165924349,"64135/3434",2
"GO:0001914","GO:0001914","regulation of T cell mediated cytotoxicity","2/43","50/18614",0.00595203238700572,0.0422792064640747,0.029521084811224,"6891/3106",2
"GO:0044409","GO:0044409","entry into host","3/43","160/18614",0.0059794121782734,0.0422792064640747,0.029521084811224,"5359/10410/6737",3
"GO:0019083","GO:0019083","viral transcription","2/43","51/18614",0.00618593821130561,0.0433558300950279,0.0302728278115602,"10410/6737",2
"GO:0002833","GO:0002833","positive regulation of response to biotic stimulus","4/43","327/18614",0.00673075489738291,0.0467641144609474,0.0326526324541231,"4938/4940/5359/64135",4
"GO:0052372","GO:0052372","modulation by symbiont of entry into host","2/43","55/18614",0.00716287833157326,0.0493374119562675,0.0344494148433197,"10410/6737",2
